# 2021 June 1
#
# The author disclaims copyright to this source code.  In place of
# a legal notice, here is a blessing:
#
#    May you do good and not evil.
#    May you find forgiveness for yourself and forgive others.
#    May you share freely, never taking more than you give.
#
#*************************************************************************
# This file implements regression tests for SQLite library.
#

set testdir [file dirname $argv0]
source $testdir/tester.tcl
set testprefix hct_delete

sqlite3 db2 test.db

do_execsql_test 1.1 {
  CREATE TABLE t1(a INTEGER PRIMARY KEY, b TEXT);
  BEGIN;
    CREATE INDEX t1b ON t1(b);
    INSERT INTO t1 VALUES(1, 'one');
    INSERT INTO t1 VALUES(2, 'two');
  COMMIT;
}

do_execsql_test -db db2 1.2 {
  BEGIN;
    SELECT * FROM t1 ORDER BY b;
} {1 one 2 two}

do_execsql_test 1.3 {
  DELETE FROM t1 WHERE a=2;
}

do_execsql_test -db db2 1.4 {
    SELECT * FROM t1 ORDER BY b;
} {1 one 2 two}

do_execsql_test -db db2 1.5 {
  END;
  SELECT * FROM t1 ORDER BY b;
} {1 one}

#execsql_pp { SELECT * FROM hctdb; }
#execsql_pp { SELECT * FROM hctentry; }

#-------------------------------------------------------------------------
proc irange {i1 i2} {
  set R [list]
  for {set i $i1} {$i<=$i2} {incr i} {
    lappend R $i
  }
  set R
}

reset_db
sqlite3 db2 test.db
do_execsql_test 2.0 {
  BEGIN;
    CREATE TABLE x1(y INTEGER PRIMARY KEY, z TEXT);
    WITH s(i) AS (
      VALUES(1) UNION ALL SELECT i+1 FROM s WHERE i<80
    ) 
    INSERT INTO x1(z) SELECT quote(randomblob(10)) FROM s;
  COMMIT;
}

do_execsql_test -db db2 2.1 {
  BEGIN;
    SELECT y FROM x1
} [irange 1 80]

do_execsql_test 2.2 {
  DELETE FROM x1 WHERE y<10
}

breakpoint
do_execsql_test -db db2 2.3 {
  SELECT y FROM x1;
  COMMIT;
} [irange 1 80]
#finish_test

#do_execsql_test -db db2 2.4 {
#  SELECT y FROM x1
#} [irange 60 80]

#execsql_pp { SELECT * FROM sqlite_schema; }
#execsql_pp { SELECT * FROM hctdb; }
#execsql_pp { SELECT * FROM hctpgmap; }
#execsql_pp { SELECT * FROM hctentry; }


finish_test

