# 2021 June 1
#
# The author disclaims copyright to this source code.  In place of
# a legal notice, here is a blessing:
#
#    May you do good and not evil.
#    May you find forgiveness for yourself and forgive others.
#    May you share freely, never taking more than you give.
#
#*************************************************************************
# This file implements regression tests for SQLite library.
#

set testdir [file dirname $argv0]
source $testdir/tester.tcl
set testprefix hct_delete

sqlite3 db2 test.db

do_execsql_test 1.1 {
  CREATE TABLE t1(a INTEGER PRIMARY KEY, b TEXT);
  BEGIN;
    CREATE INDEX t1b ON t1(b);
    INSERT INTO t1 VALUES(1, 'one');
    INSERT INTO t1 VALUES(2, 'two');
  COMMIT;
}

do_execsql_test -db db2 1.2 {
  BEGIN;
    SELECT * FROM t1 ORDER BY b;
} {1 one 2 two}

do_execsql_test 1.3 {
  DELETE FROM t1 WHERE a=2;
}

do_execsql_test -db db2 1.4 {
    SELECT * FROM t1 ORDER BY b;
} {1 one 2 two}

do_execsql_test -db db2 1.5 {
  END;
  SELECT * FROM t1 ORDER BY b;
} {1 one}

#execsql_pp { SELECT * FROM hctdb; }
#execsql_pp { SELECT * FROM hctentry; }

finish_test

