# 2025 July 24
#
# The author disclaims copyright to this source code.  In place of
# a legal notice, here is a blessing:
#
#    May you do good and not evil.
#    May you find forgiveness for yourself and forgive others.
#    May you share freely, never taking more than you give.
#
#*************************************************************************
#
# Tests focused on local commits using sqlite3_hct_journal_local_commit().
#

set testdir [file dirname $argv0]
source $testdir/tester.tcl
set testprefix hct_journal_rollback

hct_reset_db
catch_hct_journal_init db
sqlite3_hct_journal_setmode db LEADER

do_test 1.0 {
  foreach sql [split [string trim {
    CREATE TABLE meta(x INTEGER PRIMARY KEY, y);
    CREATE TABLE t1(a INTEGER PRIMARY KEY, b TEXT);
    INSERT INTO t1 VALUES(1, 'one');   
    INSERT INTO t1 VALUES(2, 'two');  
    INSERT INTO t1 VALUES(3, 'three');
    INSERT INTO t1 VALUES(4, 'four');
    INSERT INTO t1 VALUES(5, 'five');
  }] "\n"] {
    hct_write_leader db [string trim $sql]
  }
} {}

do_execsql_test 1.1 {
  BEGIN CONCURRENT;
    INSERT INTO meta VALUES(1, 'first');
}

do_test 1.2 {
  sqlite3_hct_journal_local_commit db
} {SQLITE_OK}

do_test 1.3 {
  hct_write_leader db {INSERT INTO t1 VALUES(6, 'six');}
} {SQLITE_OK 9 3}

execsql_pp { SELECT cid, snapshot, query FROM hct_journal }

do_execsql_test 1.4.1 {
  SELECT * FROM meta
} {1 first}

do_execsql_test 1.4.2 {
  SELECT * FROM t1
} {1 one 2 two 3 three 4 four 5 five 6 six}

do_execsql_test 1.4.3 {
  SELECT cid FROM hct_journal
} {1 2 3 4 5 6 7 8 9}

do_execsql_test 1.5.1 {
  BEGIN CONCURRENT;
    INSERT INTO meta VALUES(2, 'second');
    SELECT sum(a) FROM t1
} {21}

sqlite3 db2 test.db
do_test 1.5.2 {
  hct_write_leader db2 {INSERT INTO t1 VALUES(7, 'seven');}
} {SQLITE_OK 10 3}

do_test 1.5.3 {
  sqlite3_hct_journal_local_commit db
} {SQLITE_BUSY}
db eval ROLLBACK

do_execsql_test 1.5.4 {
  BEGIN CONCURRENT;
    INSERT INTO meta VALUES(2, 'second');
    SELECT sum(a) FROM t1
} {28}

do_test 1.5.5 {
  sqlite3_hct_journal_local_commit db
} {SQLITE_OK}

do_execsql_test 1.5.6 {
  SELECT cid FROM hct_journal
} {1 2 3 4 5 6 7 8 9 10}

do_test 1.6.1 {
  hct_write_leader db2 {INSERT INTO t1 VALUES(8, 'eight');}
} {SQLITE_OK 11 3}

proc hct_write_local {db sql} {
  $db eval "BEGIN CONCURRENT"
  $db eval $sql
  sqlite3_hct_journal_local_commit $db
}

do_test 1.6.2 {
  hct_write_local db { INSERT INTO meta VALUES(3, 'third') } ;# 1
  hct_write_local db { INSERT INTO meta VALUES(4, 'fourth') }
  hct_write_local db { INSERT INTO meta VALUES(5, 'fifth') }
  hct_write_local db { INSERT INTO meta VALUES(6, 'sixth') }
  hct_write_local db { INSERT INTO meta VALUES(7, 'seventh') }
  hct_write_local db { INSERT INTO meta VALUES(8, 'eighth') }
  hct_write_local db { INSERT INTO meta VALUES(9, 'ninth') }
  hct_write_local db { INSERT INTO meta VALUES(10, 'tenth') }
  hct_write_local db { INSERT INTO meta VALUES(11, 'eleventh') }
  hct_write_local db { INSERT INTO meta VALUES(12, 'twelfth') }
  hct_write_local db { INSERT INTO meta VALUES(13, 'thirteenth') }
  hct_write_local db { INSERT INTO meta VALUES(14, 'fourteenth') }
  hct_write_local db { INSERT INTO meta VALUES(15, 'fifteenth') }
  hct_write_local db { INSERT INTO meta VALUES(16, 'sixteenth') }
  hct_write_local db { INSERT INTO meta VALUES(17, 'seventeenth') } ;# 15
} {SQLITE_OK}

do_test 1.6.3 {
  hct_write_local db { INSERT INTO meta VALUES(18, 'eighteenth') }
} {SQLITE_BUSY}
db eval ROLLBACK

do_test 1.6.4 {
  hct_write_local db { INSERT INTO meta VALUES(18, 'eighteenth') }
} {SQLITE_BUSY}
db eval ROLLBACK

do_test 1.6.5 {
  hct_write_leader db2 {INSERT INTO t1 VALUES(9, 'nine');}
} {SQLITE_OK 12 3}

do_test 1.6.6 {
  hct_write_local db { INSERT INTO meta VALUES(18, 'eighteenth') }
} {SQLITE_OK}

db2 close

#-------------------------------------------------------------------------
hct_reset_db
catch_hct_journal_init db

do_execsql_test 2.0 {
  CREATE TABLE x1(a PRIMARY KEY, b) WITHOUT ROWID;
  INSERT INTO x1 VALUES(1, 2);
  INSERT INTO x1 VALUES(2, 3);
}

do_test 2.1.1 {
  hct_write_local db { INSERT INTO x1 VALUES(3, 4) }
} {SQLITE_ERROR}
do_test 2.1.2 {
  sqlite3_errmsg db
} {not a FOLLOWER or LEADER mode db}

#-------------------------------------------------------------------------
hct_reset_db
catch_hct_journal_init db
sqlite3_hct_journal_setmode db LEADER

do_test 3.0 {
  hct_write_leader db { CREATE TABLE x2(a INTEGER PRIMARY KEY, b); }
  hct_write_leader db { CREATE TABLE x1(a PRIMARY KEY, b) WITHOUT ROWID; }
  hct_write_leader db { INSERT INTO x1 VALUES('one', 1); }
  hct_write_leader db { INSERT INTO x1 VALUES('two', 2); }
  hct_write_leader db { INSERT INTO x1 VALUES('three', 3); }
  hct_write_leader db { INSERT INTO x1 VALUES('four', 4); }
} {SQLITE_OK 7 3}

forcedelete test.db2
sqlite3 db2 file:test.db2?hctree=1 -uri 1
catch_hct_journal_init db2
sqlite3_hct_journal_setmode db2 FOLLOWER

execsql_pp { SELECT cid, snapshot, query FROM hct_journal }

do_test 3.1 {
  db eval { 
    SELECT cid, snapshot, query FROM hct_journal WHERE cid<5 ORDER BY cid 
  } {
    hct_write_follower db2 $cid $snapshot $query
  }
} {}

do_test 3.2 {
  db2 eval {
    BEGIN;
      INSERT INTO x2 VALUES(123, 'one two three');
  }
  sqlite3_hct_journal_local_commit db2
} {SQLITE_OK}

do_execsql_test -db db2 3.2.2 {
  SELECT * FROM x2
} {123 {one two three}}

do_test 3.3 {
  db eval { 
    SELECT cid, snapshot, query FROM hct_journal WHERE cid=5
  } {
    hct_write_follower db2 $cid $snapshot $query
  }
} {}

do_test 3.4.1 {
  hct_write_local db2 { INSERT INTO x2 VALUES(201, 'two zero one') } ;# 1
  hct_write_local db2 { INSERT INTO x2 VALUES(202, 'two zero two') }
  hct_write_local db2 { INSERT INTO x2 VALUES(203, 'two zero three') }
  hct_write_local db2 { INSERT INTO x2 VALUES(204, 'two zero four') }
  hct_write_local db2 { INSERT INTO x2 VALUES(205, 'two zero five') }
  hct_write_local db2 { INSERT INTO x2 VALUES(206, 'two zero six') }
  hct_write_local db2 { INSERT INTO x2 VALUES(207, 'two zero seven') }
  hct_write_local db2 { INSERT INTO x2 VALUES(208, 'two zero eight') }
  hct_write_local db2 { INSERT INTO x2 VALUES(209, 'two zero nine') }
  hct_write_local db2 { INSERT INTO x2 VALUES(210, 'two one zero') }
  hct_write_local db2 { INSERT INTO x2 VALUES(211, 'two one one') }
  hct_write_local db2 { INSERT INTO x2 VALUES(212, 'two one two') }
  hct_write_local db2 { INSERT INTO x2 VALUES(213, 'two one three') }
  hct_write_local db2 { INSERT INTO x2 VALUES(214, 'two one four') }
  hct_write_local db2 { INSERT INTO x2 VALUES(215, 'two one five') } ;# 15
} {SQLITE_OK}

do_test 3.4.2 {
  hct_write_local db2 { INSERT INTO x2 VALUES(216, 'two one six') } ;# 16
} {SQLITE_BUSY}
db2 eval ROLLBACK

do_test 3.5 {
  db eval { 
    SELECT cid, snapshot, query FROM hct_journal WHERE cid>5
  } {
    hct_write_follower db2 $cid $snapshot $query
  }
  hct_write_local db2 { 
    DELETE FROM hct_journal WHERE cid<5
  }
} {SQLITE_OK}

db2 close
sqlite3 db2 test.db2
do_execsql_test -db db2 3.6.1 {
  SELECT * FROM x2 WHERE a>=213
} {
  213 {two one three} 214 {two one four} 215 {two one five}
}
do_execsql_test -db db2 3.6.2 {
  SELECT * FROM x1
} {
  four 4 one 1 three 3 two 2
}



finish_test

