# 2021 June 1
#
# The author disclaims copyright to this source code.  In place of
# a legal notice, here is a blessing:
#
#    May you do good and not evil.
#    May you find forgiveness for yourself and forgive others.
#    May you share freely, never taking more than you give.
#
#*************************************************************************
# This file implements regression tests for SQLite library.
#

set testdir [file dirname $argv0]
source $testdir/tester.tcl
set testprefix hct_delete5

hct_reset_db
sqlite3 db2 test.db

do_execsql_test 1.0 {
  CREATE TABLE t1(a INTEGER PRIMARY KEY, b TEXT);
  BEGIN;
    INSERT INTO t1 VALUES(1, 'one');
    INSERT INTO t1 VALUES(2, 'two');
    INSERT INTO t1 VALUES(3, 'three');
    INSERT INTO t1 VALUES(4, 'four');
    INSERT INTO t1 VALUES(5, 'five');
  COMMIT;
}

do_execsql_test -db db2 1.1 {
  BEGIN;
    SELECT a FROM t1 ORDER BY 1;
} {1 2 3 4 5}

do_execsql_test 1.2 {
  DELETE FROM t1 WHERE a=3;
} {}

do_execsql_test 1.3 {
  DELETE FROM t1 WHERE a=4;
} {}

do_execsql_test -db db2 1.4 {
    SELECT a FROM t1 ORDER BY 1;
  END;
} {1 2 3 4 5}

finish_test

